{
  "$schema": "https://json-schema.org/draft/2020-12/schema",
  "title": "Trusted asset catalog v1",
  "type": "object",
  "additionalProperties": false,
  "required": [
    "version",
    "spaces",
    "games"
  ],
  "properties": {
    "version": {
      "const": 1
    },
    "level_thresholds": {
      "type": "array",
      "minItems": 1,
      "maxItems": 1000,
      "uniqueItems": true,
      "items": {"type": "integer", "minimum": 0, "maximum": 1000000000}
    },
    "spaces": {
      "type": "object",
      "minProperties": 1,
      "maxProperties": 128,
      "propertyNames": {
        "type": "string",
        "pattern": "^[a-z][a-z0-9_]{1,63}$"
      },
      "additionalProperties": {
        "type": "object",
        "additionalProperties": false,
        "required": [
          "items"
        ],
        "properties": {
          "items": {
            "type": "object",
            "minProperties": 1,
            "maxProperties": 128,
            "propertyNames": {
              "type": "string",
              "pattern": "^[a-z][a-z0-9_]{1,63}$"
            },
            "additionalProperties": {
              "type": "object",
              "additionalProperties": false,
              "required": [
                "name",
                "price"
              ],
              "properties": {
                "name": {
                  "type": "string",
                  "minLength": 1,
                  "maxLength": 64
                },
                "price": {
                  "type": "integer",
                  "minimum": 0,
                  "maximum": 1000000
                }
              }
            }
          }
        }
      }
    },
    "games": {
      "type": "object",
      "minProperties": 1,
      "maxProperties": 128,
      "propertyNames": {
        "type": "string",
        "pattern": "^[a-z][a-z0-9_]{1,63}$"
      },
      "additionalProperties": {
        "type": "object",
        "additionalProperties": false,
        "required": [
          "space",
          "slots"
        ],
        "properties": {
          "space": {
            "type": "string",
            "pattern": "^[a-z][a-z0-9_]{1,63}$"
          },
          "slots": {
            "type": "object",
            "minProperties": 1,
            "maxProperties": 16,
            "propertyNames": {
              "type": "string",
              "pattern": "^[a-z][a-z0-9_]{1,63}$"
            },
            "additionalProperties": {
              "type": "object",
              "additionalProperties": false,
              "required": [
                "allowed",
                "default"
              ],
              "properties": {
                "allowed": {
                  "type": "array",
                  "minItems": 1,
                  "maxItems": 128,
                  "uniqueItems": true,
                  "items": {
                    "type": "string",
                    "pattern": "^[a-z][a-z0-9_]{1,63}$"
                  }
                },
                "default": {
                  "type": "string",
                  "pattern": "^[a-z][a-z0-9_]{1,63}$"
                }
              }
            }
          }
        }
      }
    }
  }
}
