{
  "version": 1,
  "level_thresholds": [0, 100, 250, 500, 1000, 1750, 2750, 4000, 5500, 7500, 10000],
  "spaces": {
    "starter_game": {
      "items": {
        "standard": {"name": "标准徽标", "price": 0},
        "cobalt": {"name": "蓝色徽标", "price": 25}
      }
    }
  },
  "games": {
    "starter_game": {
      "space": "starter_game",
      "slots": {"badge": {"allowed": ["standard", "cobalt"], "default": "standard"}}
    }
  }
}
